[
  {
    "domain": "1drv.ms",
    "origin": "shortener",
    "last_status": "404",
    "last_checked_at": "2026-10-01",
    "notes": "HTTP 404"
  },
  {
    "domain": "1shop.io",
    "origin": "shortener",
    "last_status": "404",
    "last_checked_at": "2026-10-01",
    "notes": "HTTP 404"
  },
  {
    "domain": "2u.pw",
    "origin": "shortener",
    "last_status": "403",
    "last_checked_at": "2026-10-01",
    "notes": "HTTP 403"
  },
  {
    "domain": "5w.fit",
    "origin": "shortener",
    "last_status": "403",
    "last_checked_at": "2026-10-01",
    "notes": "HTTP 403"
  },
  {
    "domain": "69run.fun",
    "origin": "shortener",
    "last_status": "404",
    "last_checked_at": "2026-10-01",
    "added_at": "2026-02-20",
    "source": "internal",
    "evidence": [
      "https://github.com/PeterDaveHello/url-shorteners"
    ],
    "notes": "HTTP 404"
  },
  {
    "domain": "agrd.io",
    "origin": "shortener",
    "last_status": "404",
    "last_checked_at": "2026-10-01",
    "notes": "HTTP 404"
  },
  {
    "domain": "aptg.tw",
    "origin": "shortener",
    "last_status": "dns_error",
    "last_checked_at": "2026-10-01",
    "added_at": "2026-02-20",
    "source": "internal",
    "evidence": [
      "https://github.com/PeterDaveHello/url-shorteners"
    ],
    "notes": "DNS resolution failed"
  },
  {
    "domain": "arkinv.st",
    "origin": "shortener",
    "last_status": "403",
    "last_checked_at": "2026-10-01",
    "added_at": "2026-02-20",
    "source": "internal",
    "evidence": [
      "https://github.com/PeterDaveHello/url-shorteners"
    ],
    "notes": "HTTP 403"
  },
  {
    "domain": "b23.tv",
    "origin": "shortener",
    "last_status": "404",
    "last_checked_at": "2026-10-01",
    "added_at": "2026-02-20",
    "source": "internal",
    "evidence": [
      "https://github.com/PeterDaveHello/url-shorteners"
    ],
    "notes": "HTTP 404"
  },
  {
    "domain": "b2n.ir",
    "origin": "shortener",
    "last_status": "403",
    "last_checked_at": "2026-10-01",
    "notes": "HTTP 403"
  },
  {
    "domain": "bc.vc",
    "origin": "shortener",
    "last_status": "403",
    "last_checked_at": "2026-10-01",
    "notes": "HTTP 403"
  },
  {
    "domain": "bitly.kr",
    "origin": "shortener",
    "last_status": "403",
    "last_checked_at": "2026-10-01",
    "added_at": "2026-02-20",
    "source": "internal",
    "evidence": [
      "https://bitly.kr/"
    ],
    "notes": "HTTP 404"
  },
  {
    "domain": "bitly.lc",
    "origin": "shortener",
    "last_status": "dns_error",
    "last_checked_at": "2026-10-01",
    "added_at": "2026-02-20",
    "source": "internal",
    "evidence": [
      "https://github.com/PeterDaveHello/url-shorteners"
    ],
    "notes": "DNS resolution failed"
  },
  {
    "domain": "blap.net",
    "origin": "shortener",
    "last_status": "persistent_error",
    "last_checked_at": "2026-10-01",
    "notes": "Auto-demoted after 3 consecutive months of review (connect_error)",
    "added_at": "2026-02-20",
    "source": "internal",
    "evidence": [
      "https://github.com/PeterDaveHello/url-shorteners"
    ]
  },
  {
    "domain": "bzh.me",
    "origin": "shortener",
    "last_status": "404",
    "last_checked_at": "2026-10-01",
    "notes": "HTTP 404"
  },
  {
    "domain": "c11.kr",
    "origin": "shortener",
    "last_status": "403",
    "last_checked_at": "2026-10-01",
    "notes": "HTTP 403"
  },
  {
    "domain": "clicky.me",
    "origin": "shortener",
    "last_status": "403",
    "last_checked_at": "2026-10-01",
    "notes": "HTTP 403"
  },
  {
    "domain": "clr.tax",
    "origin": "shortener",
    "last_status": "404",
    "last_checked_at": "2026-10-01",
    "notes": "HTTP 404"
  },
  {
    "domain": "coupa.ng",
    "origin": "shortener",
    "last_status": "403",
    "last_checked_at": "2026-10-01",
    "added_at": "2026-02-20",
    "source": "internal",
    "evidence": [
      "https://github.com/PeterDaveHello/url-shorteners"
    ],
    "notes": "HTTP 403"
  },
  {
    "domain": "ctbc.tw",
    "origin": "shortener",
    "last_status": "404",
    "last_checked_at": "2026-10-01",
    "notes": "HTTP 404"
  },
  {
    "domain": "cvent.me",
    "origin": "shortener",
    "last_status": "404",
    "last_checked_at": "2026-10-01",
    "notes": "HTTP 404"
  },
  {
    "domain": "cyb.ec",
    "origin": "shortener",
    "last_status": "403",
    "last_checked_at": "2026-10-01",
    "notes": "HTTP 403"
  },
  {
    "domain": "cybr.rocks",
    "origin": "shortener",
    "last_status": "dns_error",
    "last_checked_at": "2026-10-01",
    "added_at": "2026-02-20",
    "source": "internal",
    "evidence": [
      "https://github.com/PeterDaveHello/url-shorteners"
    ],
    "notes": "DNS resolution failed"
  },
  {
    "domain": "dl.gl",
    "origin": "shortener",
    "last_status": "404",
    "last_checked_at": "2026-10-01",
    "notes": "HTTP 404"
  },
  {
    "domain": "dld.bz",
    "origin": "shortener",
    "last_status": "dns_error",
    "last_checked_at": "2026-10-01",
    "added_at": "2026-02-20",
    "source": "internal",
    "evidence": [
      "https://github.com/PeterDaveHello/url-shorteners"
    ],
    "notes": "Auto-demoted after 3 consecutive months of review (connect_error)"
  },
  {
    "domain": "dopice.sk",
    "origin": "shortener",
    "last_status": "403",
    "last_checked_at": "2026-10-01",
    "notes": "HTTP 403"
  },
  {
    "domain": "dub.sh",
    "origin": "shortener",
    "last_status": "403",
    "last_checked_at": "2026-10-01",
    "added_at": "2026-02-20",
    "source": "internal",
    "evidence": [
      "https://github.com/PeterDaveHello/url-shorteners"
    ],
    "notes": "HTTP 403"
  },
  {
    "domain": "e.vg",
    "origin": "shortener",
    "last_status": "403",
    "last_checked_at": "2026-10-01",
    "notes": "HTTP 403"
  },
  {
    "domain": "etp.tw",
    "origin": "shortener",
    "last_status": "403",
    "last_checked_at": "2026-10-01",
    "notes": "HTTP 403"
  },
  {
    "domain": "firsturl.de",
    "origin": "shortener",
    "last_status": "403",
    "last_checked_at": "2026-10-01",
    "notes": "HTTP 403"
  },
  {
    "domain": "flomuz.io",
    "origin": "shortener",
    "last_status": "404",
    "last_checked_at": "2026-10-01",
    "notes": "HTTP 404"
  },
  {
    "domain": "fox.ly",
    "origin": "shortener",
    "last_status": "dns_error",
    "last_checked_at": "2026-10-01",
    "notes": "httpsconnectionpool(host='fox.ly', port=443): max retries exceeded with url: / (caused by nameresolutionerror(\"httpsconnection(host='fox.ly', port=443): failed to resolve 'fox.ly' ([errno -2] name or"
  },
  {
    "domain": "gizmo.do",
    "origin": "shortener",
    "last_status": "403",
    "last_checked_at": "2026-10-01",
    "added_at": "2026-02-20",
    "source": "internal",
    "evidence": [
      "https://github.com/PeterDaveHello/url-shorteners"
    ],
    "notes": "HTTP 403"
  },
  {
    "domain": "go.jc.fm",
    "origin": "shortener",
    "last_status": "dns_error",
    "last_checked_at": "2026-10-01",
    "notes": "DNS resolution failed"
  },
  {
    "domain": "go.osu.edu",
    "origin": "shortener",
    "last_status": "403",
    "last_checked_at": "2026-10-01",
    "added_at": "2026-07-05",
    "source": "internal",
    "evidence": [
      "https://github.com/DontPokeMe/known-link-shorteners"
    ],
    "notes": "HTTP 403"
  },
  {
    "domain": "go.redirectingat.com",
    "origin": "tracking",
    "last_status": "404",
    "last_checked_at": "2026-10-01",
    "notes": "HTTP 404"
  },
  {
    "domain": "go.usa.gov",
    "origin": "shortener",
    "last_status": "dns_error",
    "last_checked_at": "2026-10-01",
    "added_at": "2026-02-20",
    "source": "internal",
    "evidence": [
      "https://github.com/PeterDaveHello/url-shorteners"
    ],
    "notes": "DNS resolution failed"
  },
  {
    "domain": "goo.by",
    "origin": "shortener",
    "last_status": "403",
    "last_checked_at": "2026-10-01",
    "notes": "HTTP 403"
  },
  {
    "domain": "gtly.ink",
    "origin": "shortener",
    "last_status": "404",
    "last_checked_at": "2026-10-01",
    "notes": "HTTP 404"
  },
  {
    "domain": "gtly.to",
    "origin": "shortener",
    "last_status": "404",
    "last_checked_at": "2026-10-01",
    "notes": "HTTP 404"
  },
  {
    "domain": "ht.ly",
    "origin": "shortener",
    "last_status": "dns_error",
    "last_checked_at": "2026-10-01",
    "added_at": "2026-02-20",
    "source": "internal",
    "evidence": [
      "https://github.com/PeterDaveHello/url-shorteners"
    ],
    "notes": "DNS resolution failed"
  },
  {
    "domain": "ibit.ly",
    "origin": "shortener",
    "last_status": "403",
    "last_checked_at": "2026-10-01",
    "notes": "HTTP 403"
  },
  {
    "domain": "ic9.in",
    "origin": "shortener",
    "last_status": "404",
    "last_checked_at": "2026-10-01",
    "notes": "HTTP 404"
  },
  {
    "domain": "iln.io",
    "origin": "shortener",
    "last_status": "403",
    "last_checked_at": "2026-10-01",
    "notes": "HTTP 403"
  },
  {
    "domain": "inlnk.ru",
    "origin": "shortener",
    "last_status": "persistent_error",
    "last_checked_at": "2026-10-01",
    "notes": "Auto-demoted after 3 consecutive months of review (timeout)",
    "added_at": "2026-02-20",
    "source": "internal",
    "evidence": [
      "https://github.com/PeterDaveHello/url-shorteners"
    ]
  },
  {
    "domain": "is.gd",
    "origin": "shortener",
    "last_status": "403",
    "last_checked_at": "2026-10-01",
    "notes": "HTTP 403"
  },
  {
    "domain": "j.mp",
    "origin": "shortener",
    "last_status": "404",
    "last_checked_at": "2026-10-01",
    "notes": "HTTP 404"
  },
  {
    "domain": "jpeg.ly",
    "origin": "shortener",
    "last_status": "403",
    "last_checked_at": "2026-10-01",
    "notes": "HTTP 403"
  },
  {
    "domain": "kko.to",
    "origin": "shortener",
    "last_status": "403",
    "last_checked_at": "2026-10-01",
    "notes": "HTTP 403"
  },
  {
    "domain": "klck.me",